appid,name,type,release_date,required_age,developers,publishers,genres,price,metacritic_score,recommendations,achievements,year,owners_estimate,players_forever,average_playtime,median_playtime,tags,positive_reviews,negative_reviews,release_date_parsed
610460,Rise of Balloons,game,"18 May, 2017",0,Firefolk,Junkyard Sheriff,"Adventure, Indie, Free To Play",0.0,,,0,2017,"0 .. 20,000",,0,0,"Adventure, Indie, Free to Play, Female Protagonist, Puzzle",11,3,2017-05-18
458820,"States, Firms, & Households",game,"14 Apr, 2016",0,DMD 'Ware,DMD 'Ware,"Indie, Simulation, Strategy",26.0,,,0,2016,"0 .. 20,000",,0,0,"Strategy, Simulation, Indie",0,5,2016-04-14
356400,Thumper,game,"10 Oct, 2016",0,Drool,Drool,"Action, Indie",19.99,86.0,3979.0,0,2016,"200,000 .. 500,000",,348,171,"Rhythm, Indie, Action, Psychedelic, Great Soundtrack",3867,346,2016-10-10
230070,The Age of Decadence,game,"14 Oct, 2015",0,Iron Tower Studio,Iron Tower Studio,"Indie, RPG",14.5,81.0,3434.0,0,2015,"200,000 .. 500,000",,874,231,"Turn-Based Combat, Choices Matter, Tactical RPG, CRPG, Difficult",3068,676,2015-10-14
491650,Reset 1-1,game,"30 Aug, 2016",0,Panda Indie Studio,New Reality Games,Indie,1.1,,141.0,0,2016,"200,000 .. 500,000",,244,255,"Indie, Platformer, Pixel Graphics, 2D",172,92,2016-08-30
669750,Brain Storm : Tower Bombarde,game,"28 Jul, 2017",0,SaintHeiser,Half-Face Games,"Casual, Indie, Free To Play",0.0,,,0,2017,"0 .. 20,000",,0,0,"Indie, Free to Play, Casual",18,18,2017-07-28
890030,Shadow of the Tomb Raider: Definitive Edition,game,"14 Sep, 2018",18,"Eidos-Montréal, Crystal Dynamics, Nixxes, Feral Interactive (Mac), Feral interactive (Linux)","Crystal Dynamics, Feral Interactive (Mac), Feral interactive (Linux)","Action, Adventure",0.0,77.0,66346.0,0,2018,"0 .. 20,000",,0,0,"Adventure, Lara Croft, Action, Female Protagonist, Third Person",12819,4747,2018-09-14
647670,Grand Expanse,game,"8 Aug, 2017",0,Tendril Studio,Tendril Studio,"Animation & Modeling, Video Production",1.1,,,0,2017,"0 .. 20,000",,437,437,"Video Production, Animation & Modeling, VR",8,2,2017-08-08
808090,"Bury Me, My Love",game,"10 Jan, 2019",0,"The Pixel Hunt, ARTE France, FIGS",PID Games,"Adventure, Indie, Simulation",5.25,,115.0,0,2019,"0 .. 20,000",,0,0,"Indie, Adventure, Simulation, Interactive Fiction, Female Protagonist",108,51,2019-01-10
613210,BlobCat,game,"31 Aug, 2017",0,BySamb,BySamb,"Casual, Indie, Strategy",10.5,,,0,2017,"0 .. 20,000",,205,205,"Indie, Casual, Strategy, Puzzle, Cats",63,4,2017-08-31
1102500,A Glider's Journey,game,"27 Sep, 2019",0,"Emma Franklin, Charlie Marshall",Emma Franklin,"Action, Adventure, Casual, Indie, Simulation",10.0,,,0,2019,"0 .. 20,000",,0,0,"Casual, Action, Indie, Adventure, Simulation",47,27,2019-09-27
761170,Radical Dungeon Sweeper,game,"12 Feb, 2018",0,"Benjamin Soulé, Mathieu Leyssenne, Yoann Laulan",Benjamin Soulé,"Casual, Indie, RPG, Strategy",13.0,,180.0,0,2018,"20,000 .. 50,000",,2545,2962,"Casual, Indie, Strategy, RPG, Rogue-like",162,40,2018-02-12
302830,BLOCKADE 3D,game,"19 Dec, 2014",0,Novalink,Novalink,"Action, Free To Play, Early Access",0.0,,406.0,0,2014,"2,000,000 .. 5,000,000",,681,111,"Free to Play, Shooter, Multiplayer, FPS, Action",14974,10584,2014-12-19
824830,Corpse Party: Blood Drive,game,"10 Oct, 2019",0,"MAGES. Inc., 5pb.",XSEED Games,Indie,18.5,,341.0,0,2019,"20,000 .. 50,000",,604,607,"Gore, Anime, Violent, Indie, Horror",264,80,2019-10-10
334480,Robinson Crusoe and the Cursed Pirates,game,"10 Feb, 2015",0,MagicIndie,MumboJumbo,"Adventure, Casual",10.5,,,0,2015,"20,000 .. 50,000",,0,0,"Adventure, Casual, Pirates, Hidden Object, Point & Click",34,9,2015-02-10
921920,Robikon,game,"13 Sep, 2018",0,StalkerAlex..,StalkerAlex...,"Casual, Indie",1.1,,,0,2018,"20,000 .. 50,000",,0,0,"Indie, Casual",0,1,2018-09-13
906010,TAL: Arctic 2,game,"3 Aug, 2018",0,Snkl Studio,Snkl Studio,"Adventure, Casual, Indie",1.1,,,0,2018,"0 .. 20,000",,0,0,"Indie, Casual, Adventure, Puzzle, Relaxing",26,17,2018-08-03
1041320,Lords Mobile: Kingdom Wars,game,"2 Jun, 2019",0,IGG SINGAPORE PTE. LTD.,IGG SINGAPORE PTE. LTD.,"Massively Multiplayer, RPG, Strategy, Free To Play",0.0,,,0,2019,"500,000 .. 1,000,000",,12878,1708,"Free to Play, Strategy, Massively Multiplayer, NSFW, War",3761,1856,2019-06-02
955360,Stronghold: A Hero's Fate,game,"16 Nov, 2018",0,Choice of Games,Choice of Games,"Adventure, Indie, RPG",7.5,81.0,,0,2018,"0 .. 20,000",,0,0,"Adventure, Indie, RPG, Text-Based, Choose Your Own Adventure",13,5,2018-11-16
922650,Caveman Chuck,game,"20 Sep, 2018",0,Prime Bit Games SA,Prime Bit Games SA,"Action, Adventure",5.25,,,0,2018,"0 .. 20,000",,0,0,"Platformer, 2D, Dinosaurs, Retro, Indie",19,1,2018-09-20
827540,A Penny For Some Motivation,game,"10 Apr, 2018",0,LJumpStarTD,LJumpStarTD,"Adventure, Casual, Indie",1.1,,,0,2018,"0 .. 20,000",,0,0,"Adventure, Indie, Casual",1,3,2018-04-10
498000,Mushroom Crusher Extreme,game,"10 May, 2019",0,"Mushroom Party, Team Jolly Roger",Team Jolly Roger,"Action, Indie",8.5,,,0,2019,"0 .. 20,000",,0,0,"Indie, Pixel Graphics, Difficult, Isometric, Arcade",13,2,2019-05-10
488821,Tom Clancy's Rainbow Six® Siege X,game,"1 Dec, 2015",0,Ubisoft Montreal,Ubisoft,"Action, Free To Play",0.0,,1222380.0,0,2015,"0 .. 20,000",,0,0,"FPS, Multiplayer, Tactical, Shooter, Team-Based",312232,64137,2015-12-01
321260,Wickland,game,"6 Feb, 2015",0,Mad Ram Software,Mad Ram Software,"Action, Indie",0.0,,400.0,0,2015,"100,000 .. 200,000",,111,104,"Action, Multiplayer, Indie, FPS, Arena Shooter",443,407,2015-02-06
504260,Happy Pong,game,"22 Aug, 2016",0,Poppgames,Poppgames,"Casual, Indie",3.5,,,0,2016,"0 .. 20,000",,0,0,"Indie, Casual, Psychedelic, Arcade, Fast-Paced",8,3,2016-08-22
936010,Feed the Pets Origins,game,"1 Oct, 2018",0,"Volrest, Meine Liebe:3",Volrest Games,"Casual, Indie",10.0,,,0,2018,"0 .. 20,000",,0,0,"Indie, Casual, Clicker, Colorful",16,9,2018-10-01
778980,The Drain Collector,game,"4 Jan, 2018",0,R H C s,River Hastings Carley,"Casual, Indie, Racing, Simulation, Strategy",2.15,,,0,2018,"0 .. 20,000",,0,0,,0,0,2018-01-04
851350,Let's Play with Nanai!,game,"1 Nov, 2018",0,VRJCC,ImagineVR,Simulation,34.0,,,0,2018,"0 .. 20,000",,47,47,"Nudity, Sexual Content, Simulation, VR, Anime",4,7,2018-11-01
555890,Burgers 2,game,"13 Jan, 2017",0,Digitized Organism,Digitized Organism,"Action, Adventure, Indie, RPG",3.25,,,0,2017,"0 .. 20,000",,83,83,"Indie, Action, Adventure, RPG, Top-Down Shooter",23,11,2017-01-13
1031910,The Path To Die,game,"8 Mar, 2019",0,Cat Logic Games,Cat Logic Games,"Action, Adventure, Indie",10.0,,,0,2019,"0 .. 20,000",,0,0,"Action, Indie, Adventure, Gore, Violent",14,3,2019-03-08
526160,The Wild Eight,game,"3 Oct, 2019",0,Eight Points,HypeTrain Digital,"Action, Adventure, Indie, RPG, Simulation",22.0,,6657.0,0,2019,"200,000 .. 500,000",,401,236,"Survival, Open World Survival Craft, Multiplayer, Open World, Mystery",5407,2490,2019-10-03
1006760,Cyborg Ninja vs. The Third Reich,game,"11 Mar, 2019",0,Shawn Perolis,Anarchy Softworks LLC,"Action, Indie",1.1,,,0,2019,"20,000 .. 50,000",,0,0,"Action, Indie, Violent, Platformer, 2D",5,1,2019-03-11
391780,Uebergame,game,"26 Oct, 2015",0,Duion,Duion,"Action, Casual, Free To Play, Indie",0.0,,,0,2015,"200,000 .. 500,000",,16,16,"Free to Play, Action, Multiplayer, Casual, Indie",254,223,2015-10-26
544990,NOBUNAGA'S AMBITION,game,"13 Dec, 2016",0,"KOEI TECMO GAMES CO., LTD.","KOEI TECMO GAMES CO., LTD.",Strategy,13.9,,,0,2016,"20,000 .. 50,000",,0,0,"Wargame, Immersive Sim, Diplomacy, War, Military",9,1,2016-12-13
355860,Albino Lullaby: Episode 1,game,"14 Sep, 2015",0,Ape Law,Ape Law,"Action, Adventure, Indie",22.0,,253.0,0,2015,"20,000 .. 50,000",,273,278,"Indie, Adventure, Horror, Action, Surreal",266,113,2015-09-14
386710,C:\raft,game,"2 Oct, 2017",0,Nicholas Hydock,Luna.red,"Adventure, Casual, Indie, RPG",4.25,,,0,2017,"0 .. 20,000",,0,0,"Indie, Casual, RPG, Rogue-like, Crafting",18,13,2017-10-02
371100,Waste Walkers,game,"1 Jun, 2015",0,Corrosive Studios LLC,Corrosive Studios LLC,"Action, Adventure, Indie, RPG, Simulation, Strategy",9.0,,145.0,0,2015,"20,000 .. 50,000",,167,172,"Choose Your Own Adventure, Character Customization, Open World, Survival, CRPG",165,40,2015-06-01
529730,Seabed Prelude,game,"24 Feb, 2017",0,MythicOwl,MythicOwl,"Adventure, Casual, Indie, Simulation",0.0,,,0,2017,"0 .. 20,000",,0,0,"Simulation, Adventure, Indie, Casual, VR",4,3,2017-02-24
1183030,Layers of Fear VR,game,"10 Dec, 2019",0,Incuvo S.A.,Bloober Team SA,"Adventure, Indie",18.5,,246.0,0,2019,"0 .. 20,000",,99,99,"Indie, Adventure, Horror, VR, Psychological Horror",183,67,2019-12-10
774661,Filthy Frank Kart,game,"29 Sep, 2019",0,Adam David,Adam David,"Casual, Indie, Racing, Early Access",7.5,,,0,2019,"0 .. 20,000",,0,0,"Memes, Retro, Indie, Combat Racing, Cartoony",6,5,2019-09-29
301360,Kill Fun Yeah,game,"30 May, 2014",0,Arctic Anteater,Arctic Anteater,"Action, Indie",10.5,,,0,2014,"0 .. 20,000",,5,5,"Action, Indie, Platformer, Multiplayer, Shooter",36,46,2014-05-30
957150,冷月清辉照天涯(KUNG FU LEGEND),game,"25 Apr, 2019",0,个人工作室（Two friends）,个人工作室（Two friends ）,"Adventure, Indie, RPG",5.25,,,0,2019,"0 .. 20,000",,0,0,"RPG, Adventure, Indie",3,2,2019-04-25
951190,Ancient lands: the Tsar awakening,game,"29 Apr, 2019",0,Anatoliy Sidorov,Anatoliy Sidorov,"Adventure, Indie, Strategy",10.0,,,0,2019,"0 .. 20,000",,0,0,"Turn-Based, Strategy, Indie, Adventure, Card Game",18,0,2019-04-29
805940,RUSSIA BATTLEGROUNDS,game,"13 Jul, 2018",0,Agafonoff,Agafonoff,"Action, Adventure, Indie, Massively Multiplayer, RPG",0.71,,3777.0,0,2018,"200,000 .. 500,000",,773,119,"Action, Battle Royale, Multiplayer, FPS, Memes",3424,1018,2018-07-13
448560,Mind Games,game,"4 Mar, 2016",0,AK Games,My Way Games,Indie,5.5,,141.0,0,2016,"50,000 .. 100,000",,283,345,"Indie, Tabletop, Puzzle, Singleplayer, Mouse only",133,54,2016-03-04
712870,Vectorium,game,"2 May, 2018",0,IndigoBlue Game Studio,IndigoBlue Game Studio,"Action, Casual, Indie",5.25,,,0,2018,"0 .. 20,000",,28,28,"Twin Stick Shooter, Bullet Hell, Shoot 'Em Up, Rhythm, Shooter",59,17,2018-05-02
1099110,愚者地牢-UP主的消失,game,"18 Jun, 2019",0,老梅,无,"Adventure, Casual, Indie, RPG, Free To Play",0.0,,,0,2019,"0 .. 20,000",,0,0,"Free to Play, Indie, Casual, Adventure, RPG",169,31,2019-06-18
748730,Seek Not a Lighthouse,game,"20 Nov, 2017",0,"MidnightCoffee, Inc.","MidnightCoffee, Inc.","Adventure, Indie",5.25,,,0,2017,"0 .. 20,000",,0,0,"Adventure, Indie, Point & Click",7,3,2017-11-20
996380,Smartphone Tycoon,game,"1 Mar, 2019",0,Roastery Games,Roastery Games,"Indie, Simulation, Strategy",7.5,,1607.0,0,2019,"200,000 .. 500,000",,212,182,"Simulation, Strategy, Indie, Management, Singleplayer",886,765,2019-03-01
821320,SPAGHET,game,"13 Apr, 2018",0,Torrey Daniel,TD Indie,"Casual, Indie, Strategy",2.15,,147.0,0,2018,"0 .. 20,000",,16,16,"Indie, Casual, Strategy, Memes, Horror",163,15,2018-04-13
21110,F.E.A.R.,game,"21 May, 2010",0,"Monolith Productions, Inc., Timegate","Warner Bros. Games, Warner Bros. Interactive Entertainment",Action,2.1,88.0,12901.0,0,2010,"1,000,000 .. 2,000,000",,236,210,,0,0,2010-05-21
1111090,Alpha Lyrae Discovery,game,"8 Aug, 2019",0,xe2050,"WELOVEBOT CO., LTD.","Casual, Indie, RPG, Simulation, Strategy, Early Access",11.0,,,0,2019,"0 .. 20,000",,0,0,"Colony Sim, City Builder, Tower Defense, Sandbox, Casual",15,3,2019-08-08
295670,Hive Jump,game,"18 Jan, 2017",0,Graphite Lab,Graphite Lab,"Action, Indie",18.5,,187.0,0,2017,"100,000 .. 200,000",,161,169,"Platformer, Shooter, Rogue-like, Arcade, 2D",249,113,2017-01-18
602430,Yono and the Celestial Elephants,game,"12 Oct, 2017",0,Neckbolt,Plug In Digital,"Adventure, Indie",14.5,,183.0,0,2017,"20,000 .. 50,000",,432,496,"Adventure, Indie, Cute, Puzzle, Family Friendly",267,54,2017-10-12
587070,PROTOThYPE _ a love story,game,"15 Feb, 2017",0,Monkeys Tales Studio,Monkeys Tales Studio,"Adventure, Indie, Strategy",5.25,,,0,2017,"0 .. 20,000",,211,211,"Adventure, Indie, Casual, Action, Point & Click",14,7,2017-02-15
409710,BioShock™ Remastered,game,"15 Sep, 2016",18,"2K Boston, 2K Australia, Blind Squirrel, Feral Interactive (Mac)","2K, Feral Interactive (Mac)","Action, RPG",20.0,80.0,48866.0,0,2016,"2,000,000 .. 5,000,000",,492,216,"FPS, Story Rich, Atmospheric, Horror, Singleplayer",47962,10301,2016-09-15
695460,Coffee Pixes,game,"7 Nov, 2017",0,Fuyu Games AB,Fuyu Games AB,Indie,1.1,,,0,2017,"0 .. 20,000",,0,0,"Indie, Casual",3,2,2017-11-07
416600,Full Metal Furies,game,"17 Jan, 2018",0,Cellar Door Games,Cellar Door Games,"Action, Adventure, Indie, RPG",18.5,85.0,2059.0,0,2018,"200,000 .. 500,000",,463,314,"Action, Co-op, Indie, RPG, Beat 'em up",2558,261,2018-01-17
302290,Infinite Game Works Episode 0,game,"10 Jun, 2014",0,Sakura River Interactive,Sakura River Interactive,"Casual, Indie, Simulation",12.0,,,0,2014,"0 .. 20,000",,0,0,"Simulation, Indie, Casual, Visual Novel, Anime",6,11,2014-06-10
460910,A-Gents,game,"20 Apr, 2016",0,phime studio LLC,phime studio LLC,"Action, Indie",5.25,,,0,2016,"50,000 .. 100,000",,272,267,"Action, Indie, Pixel Graphics, Military, Retro",104,26,2016-04-20
283640,Salt and Sanctuary,game,"17 May, 2016",0,Ska Studios,Ska Studios,"Action, Indie, RPG",18.0,84.0,19422.0,0,2016,"1,000,000 .. 2,000,000",,922,365,"Souls-like, Metroidvania, Dark Fantasy, 2D, Difficult",18485,2167,2016-05-17
1055620,Minions Battle,game,"17 May, 2019",0,RewindApp,RewindApp,"Action, Casual, Indie",0.6,,,0,2019,"0 .. 20,000",,0,0,"Action, Indie, Casual, 2D, Multiplayer",78,23,2019-05-17
866960,Slime Kingdom,game,"14 Jun, 2018",0,Po-Jui Huang,Po-Jui Huang,"Adventure, Casual, Indie, RPG, Early Access",0.0,,,0,2018,"0 .. 20,000",,0,0,"Indie, Casual, Adventure, RPG, Early Access",12,3,2018-06-14
693880,Trivia Vault: 1980's Trivia 2,game,"22 Aug, 2017",0,Ripknot Systems,Ripknot Systems,"Action, Casual, Indie, Simulation, Strategy",14.0,,,0,2017,"20,000 .. 50,000",,1,1,"Casual, Indie, Simulation, Strategy, Action",72,65,2017-08-22
260230,Valiant Hearts: The Great War™ / Soldats Inconnus : Mémoires de la Grande Guerre™,game,"25 Jun, 2014",0,Ubisoft Montpellier,Ubisoft,Adventure,4.97,,23641.0,0,2014,"500,000 .. 1,000,000",,325,225,"Atmospheric, Historical, World War I, Adventure, War",24888,1155,2014-06-25
466720,Vintage VR,game,"2 May, 2016",0,Dunderware,MuseumSyndicate.com,"Casual, Free To Play",0.0,,,0,2016,"50,000 .. 100,000",,139,168,"Free to Play, Casual, VR",89,11,2016-05-02
811250,Content Creator Simulator,game,"9 Mar, 2018",0,Epic Fire,DNB Media,"Casual, Simulation",1.1,,,0,2018,"0 .. 20,000",,0,0,"Casual, Simulation, Clicker",12,9,2018-03-09
698830,Puzzle Dating,game,"14 Sep, 2017",0,M. Hanka,Liu Lidan,"Casual, Indie, Simulation",1.1,,,0,2017,"20,000 .. 50,000",,11,12,"Casual, Indie, Simulation, Puzzle, Match 3",43,27,2017-09-14
643620,Night Trap - 25th Anniversary Edition,game,"15 Aug, 2017",0,Screaming Villains,Screaming Villains,Action,14.5,,161.0,0,2017,"50,000 .. 100,000",,127,128,"Action, FMV, Horror, Classic, Singleplayer",159,27,2017-08-15
297120,Heavy Bullets,game,"18 Sep, 2014",0,"Terri Vellmann, Doseone",Devolver Digital,"Action, Indie",10.0,72.0,1245.0,0,2014,"100,000 .. 200,000",,176,101,"Indie, Action, FPS, Action Roguelike, Rogue-like",1251,279,2014-09-18
431390,Diorama No.1 : Blocked In,game,"5 Apr, 2016",0,The Shoebox Diorama (Daniel Ernst),The Shoebox Diorama,"Casual, Indie, Simulation",0.0,,,0,2016,"0 .. 20,000",,0,0,"Casual, Indie, Simulation, VR",28,11,2016-04-05
623050,CyberClub-2077,game,"27 Sep, 2017",0,Dalian Magical Storm Network Technology Co. Ltd.,Dalian Magical Storm Network Technology Co. Ltd.,"Casual, Simulation, Sports",10.5,,,0,2017,"0 .. 20,000",,0,0,"Casual, Simulation, Sports, Music, VR",8,4,2017-09-27
470270,Tribal Pass,game,"26 Aug, 2016",0,"Tribe Tea, Stas Shostak, Evgeniy Yudin, Alexzander Protasenya, Ruslan Viter",Stas Shostak,"Action, Adventure, Indie",7.5,,260.0,0,2016,"100,000 .. 200,000",,250,262,"Adventure, Indie, Action, Pixel Graphics, Runner",324,103,2016-08-26
848610,Adult Toy Store,game,"12 Dec, 2018",0,ChaoYe Liu,KiwiGame,"Casual, Indie, Simulation, Early Access",18.5,,,0,2018,"0 .. 20,000",,0,0,"Casual, Simulation, Indie, Early Access, Sexual Content",3,6,2018-12-12
529640,SteamVR Driver for FOVE,game,"11 Jan, 2019",0,"FOVE, Inc.","FOVE, Inc.",,0.0,,,0,2019,"0 .. 20,000",,0,0,,5,1,2019-01-11
346210,Garden Rescue,game,"2 Feb, 2015",0,Rainbow Games,Rainbow Games,"Casual, Strategy",4.5,,,0,2015,"100,000 .. 200,000",,252,232,"Strategy, Casual, Tower Defense",109,37,2015-02-02
1046530,Universe 24,game,"23 Apr, 2019",0,Allsvinn,Allsvinn,"Action, Indie",8.5,,,0,2019,"0 .. 20,000",,0,0,"Action, Indie, Gore, Violent, 3D Platformer",5,2,2019-04-23
786580,Gleaner Heights,game,"21 Feb, 2018",0,Emilios Manolidis,Emilios Manolidis,"Action, Adventure, Casual, Indie, RPG, Simulation",10.0,65.0,354.0,0,2018,"20,000 .. 50,000",,1253,1287,"Farming Sim, RPG, Indie, Simulation, Action",273,99,2018-02-21
434820,Brushwood Buddies,game,"17 Feb, 2016",0,Steven Colling,Steven Colling,"Casual, Indie",3.25,,149.0,0,2016,"50,000 .. 100,000",,181,197,"Indie, Casual, Puzzle, Pixel Graphics, Cute",149,29,2016-02-17
334850,1931: Scheherazade at the Library of Pergamum,game,"26 Mar, 2015",0,"Black Chicken Studios, inc.","Black Chicken Studios, inc.","Casual, Indie, RPG, Simulation",2.15,,179.0,0,2015,"50,000 .. 100,000",,245,299,"Simulation, RPG, Visual Novel, Female Protagonist, Indie",151,57,2015-03-26
963980,STARBOY,game,"30 Nov, 2018",0,"BoominShit, Banjo","BoominShit, Banjo","Action, Adventure, Strategy",10.0,,,0,2018,"0 .. 20,000",,0,0,,0,0,2018-11-30
267340,Beware Planet Earth,game,"11 Apr, 2014",0,Lightmare Studio,Jumping Ram,"Casual, Indie, Strategy",2.62,,167.0,0,2014,"50,000 .. 100,000",,411,617,"Tower Defense, Casual, Indie, Singleplayer, Family Friendly",230,91,2014-04-11
1002600,Temple of Pizza,game,"13 Jan, 2019",0,Paul Kohler,Paul Kohler,"Action, Adventure, Casual, Simulation",0.0,,,0,2019,"0 .. 20,000",,0,0,"Action, Casual, Simulation, Adventure, VR",5,6,2019-01-13
1132860,Jera,game,"21 Aug, 2019",0,DigiPen Europe-Bilbao,DigiPen Institute of Technology,Action,0.0,,,0,2019,"0 .. 20,000",,0,0,"Action, Free to Play, Platformer",20,12,2019-08-21
46350,Real Warfare 1242,game,"30 Nov, 2011",0,Unicorn Games Studio,Fulqrum Publishing,Strategy,4.25,,,0,2011,"20,000 .. 50,000",,15,15,"Strategy, RTS, Medieval, Historical",49,42,2011-11-30
720150,Shikhondo(食魂徒) - Soul Eater,game,"9 Oct, 2017",0,DeerFarm,DeerFarm,"Action, Casual, Indie",10.0,,203.0,0,2017,"50,000 .. 100,000",,0,0,"Indie, Action, Shoot 'Em Up, Bullet Hell, Casual",178,35,2017-10-09
399790,Destiny Warriors RPG,game,"11 Sep, 2015",0,ninjalex,Senpai Industrial Studios,"Adventure, Indie, RPG",0.6,,1016.0,0,2015,"200,000 .. 500,000",,267,266,"Anime, RPGMaker, RPG, Adventure, Indie",589,555,2015-09-11
416800,Cluck Yegger in Escape From The Planet of The Poultroid,game,"9 Nov, 2015",0,Guys From Andromeda LLC,Guys From Andromeda LLC,"Action, Casual, Strategy",3.5,,,0,2015,"0 .. 20,000",,0,0,"Strategy, Action, Casual, Horror, Comedy",48,20,2015-11-09
987800,CandyVenture,game,"14 Dec, 2018",0,Stephen Miller,Cellular Bits,"Adventure, Casual",0.0,,,0,2018,"0 .. 20,000",,0,0,"Casual, Adventure, Souls-like",19,5,2018-12-14
836870,Art of Murder - Deadly Secrets,game,"13 Jul, 2018",0,City Interactive S.A.,City Interactive S.A.,Adventure,0.0,,,0,2018,"0 .. 20,000",,6,6,"Adventure, Hidden Object, Point & Click, Detective",9,52,2018-07-13
849178,Shadow of the Tomb Raider: Definitive Edition,game,"14 Sep, 2018",18,"Eidos-Montréal, Crystal Dynamics, Nixxes, Feral Interactive (Mac), Feral interactive (Linux)","Crystal Dynamics, Feral Interactive (Mac), Feral interactive (Linux)","Action, Adventure",0.0,77.0,66346.0,0,2018,"0 .. 20,000",,0,0,"Adventure, Lara Croft, Action, Female Protagonist, Third Person",13036,4825,2018-09-14
1121400,Drums of War,game,"1 Oct, 2019",0,Grind Core Games LLC,"Grind Core Games LLC, Indietopia Games","Action, Adventure, Indie",14.5,,,0,2019,"0 .. 20,000",,0,0,"Action, Indie, Adventure, VR, Rhythm",10,2,2019-10-01
301500,BOMB: Who let the dogfight?,game,"29 Jul, 2015",0,La Moustache Studio,La Moustache Studio,"Action, Adventure, Indie, Simulation",8.5,,,0,2015,"0 .. 20,000",,0,0,"Simulation, Indie, Action, Adventure, Flight",50,29,2015-07-29
861230,Arevoatl Seven Coins,game,"7 Jun, 2018",0,Arevoatl Games,Arevoatl Games,Indie,1.1,,,0,2018,"0 .. 20,000",,0,0,"Indie, Hidden Object",18,3,2018-06-07
838760,Haunted Legends: The Stone Guest Collector's Edition,game,"2 May, 2018",0,AMAX Interactive,BFG Entertainment,"Adventure, Casual",0.0,,,0,2018,"0 .. 20,000",,0,0,"Adventure, Casual, Hidden Object",1,1,2018-05-02
911880,Caramba!,game,"14 Aug, 2018",0,Russian Pirates,Russian Pirates,"Adventure, Casual, Indie",2.15,,,0,2018,"20,000 .. 50,000",,0,0,"Indie, Casual, Adventure",21,62,2018-08-14
425720,Cloudlands : VR Minigolf,game,"5 Apr, 2016",0,Futuretown,Futuretown,"Casual, Sports",0.0,,293.0,0,2016,"20,000 .. 50,000",,138,167,"Sports, Casual, VR, Mini Golf, Multiplayer",256,49,2016-04-05
619590,CubeBall VR,game,"10 May, 2017",0,Tachyon Factory,Tachyon Factory,"Casual, Indie, Simulation",3.25,,,0,2017,"0 .. 20,000",,0,0,"Casual, Indie, Simulation, VR",1,0,2017-05-10
1203460,Koo & Yuu,game,"26 Dec, 2019",0,BlueFront,BlueFront,"Casual, Indie",1.1,,,0,2019,"0 .. 20,000",,0,0,"Indie, Casual, Puzzle, Relaxing, Minimalist",23,1,2019-12-26
652880,Samsara,game,"6 Feb, 2018",0,JaffaJam,JaffaJam,"Casual, Indie, Strategy",14.5,,,0,2018,"20,000 .. 50,000",,0,0,"Indie, Casual, Strategy, Puzzle",29,1,2018-02-06
1106180,SpriteStack,game,"15 Jul, 2019",0,Rezoner,Rezoner,"Animation & Modeling, Design & Illustration, Game Development",26.0,,,0,2019,"0 .. 20,000",,438,438,"Animation & Modeling, Design & Illustration, Game Development, Pixel Graphics",56,39,2019-07-15
6200,Ghost Master®,game,"21 Dec, 2006",0,Sick Puppies,Strategy First,Strategy,5.5,81.0,1679.0,0,2006,"200,000 .. 500,000",,114,44,"Strategy, Comedy, Puzzle, Simulation, Classic",1685,191,2006-12-21
360010,Remnants Of Isolation,game,"1 May, 2015",0,Team Isolation,KOMODO,"Casual, Indie, RPG",5.25,,,0,2015,"100,000 .. 200,000",,271,272,"RPG, Indie, Casual, RPGMaker, Female Protagonist",90,25,2015-05-01
508530,HackyZack,game,"28 Mar, 2017",0,Spaceboy Games,Spaceboy Games,"Action, Indie, Sports",10.5,,,0,2017,"50,000 .. 100,000",,303,314,"Indie, Sports, Action, Platformer, Puzzle-Platformer",169,82,2017-03-28
663670,Killer Queen Black,game,"11 Oct, 2019",0,"Liquid Bit, LLC, BumbleBear Games, LLC","Liquid Bit, LLC","Action, Casual, Sports, Strategy",0.0,,425.0,0,2019,"50,000 .. 100,000",,187,215,"Action, Strategy, Online Co-Op, Multiplayer, Platformer",503,43,2019-10-11
801180,Beer Pong VR,game,"3 Mar, 2018",0,Axis Granted Creations Team,Axis Granted Creations,"Action, Casual, Indie, Sports, Strategy",10.0,,,0,2018,"0 .. 20,000",,0,0,"Action, Indie, Casual, Sports, Strategy",1,4,2018-03-03
372800,RPG MO,game,"18 Aug, 2015",0,Marxnet,Marxnet,"Adventure, Indie, Massively Multiplayer, RPG, Free To Play, Early Access",0.0,,,0,2015,"500,000 .. 1,000,000",,340,43,"Free to Play, RPG, MMORPG, Massively Multiplayer, Pixel Graphics",2289,613,2015-08-18
298630,The Escapists,game,"13 Feb, 2015",0,Mouldy Toof Studios,Team17,"Action, Adventure, Indie, Simulation, Strategy",4.0,71.0,14213.0,0,2015,"500,000 .. 1,000,000",,790,336,"Pixel Graphics, Strategy, Crafting, Singleplayer, 2D",14481,1569,2015-02-13
734920,MEANDERS,game,"7 Feb, 2018",0,"ATOMIC BREATH, FraZack","ATOMIC BREATH, FraZack","Action, Adventure, Casual, Indie",2.99,,358.0,0,2018,"0 .. 20,000",,136,203,"Casual, 3D Platformer, Puzzle, Parkour, Indie",369,34,2018-02-07
1046650,Hentai Pair,game,"9 Aug, 2019",18,Reddiamondgames,Reddiamondgames,"Casual, Indie, Simulation",1.1,,,0,2019,"0 .. 20,000",,0,0,,0,0,2019-08-09
1161570,Dark Parables: Portrait of the Stained Princess Collector's Edition,game,"20 Sep, 2019",0,"Eipix Entertainment, Blue Tea Games",BFG Entertainment,"Adventure, Casual",10.0,,,0,2019,"20,000 .. 50,000",,0,0,"Adventure, Casual, Hidden Object",29,5,2019-09-20
801490,HellCrunch,game,"16 Mar, 2018",0,TensionSplice,TensionSplice,"Action, Indie",4.25,,,0,2018,"0 .. 20,000",,0,0,"Action, Indie, Violent, FPS, Shooter",6,5,2018-03-16
1124660,STORM AREA 51: AYY LMAO EDITION,game,"19 Sep, 2019",0,Agafonoff,Agafonoff,"Action, Adventure, Casual, Indie, Massively Multiplayer, RPG, Simulation, Strategy",0.71,,856.0,0,2019,"200,000 .. 500,000",,177,207,"Memes, Action, Massively Multiplayer, Indie, Casual",789,224,2019-09-19
1193280,Reverse Fantasy Legend 2,game,"12 Dec, 2019",0,废材炼金术士,废材炼金术士,"Adventure, Indie, RPG",0.0,,,0,2019,"0 .. 20,000",,0,0,"Visual Novel, Turn-Based, JRPG, RPG, Lore-Rich",1,0,2019-12-12
834170,Chameleon Video Player,game,"16 May, 2018",0,Christopher Cinq-Mars Jarvis,Cinq-Mars Media,"Education, Software Training, Utilities",0.0,,,0,2018,"0 .. 20,000",,0,0,"Utilities, Education, Software Training, Software",17,21,2018-05-16
567380,Heartbound,game,"24 Dec, 2018",0,Pirate Software,Pirate Software,"Action, Adventure, Indie, RPG, Early Access",10.0,,3195.0,0,2018,"100,000 .. 200,000",,175,153,"Story Rich, RPG, Adventure, Indie, Great Soundtrack",2257,400,2018-12-24
555510,MachiaVillain,game,"16 May, 2018",0,Wild Factor,Good Shepherd Entertainment,"Indie, Simulation, Strategy",18.5,65.0,705.0,0,2018,"100,000 .. 200,000",,220,148,"Indie, Strategy, Simulation, Villain Protagonist, Base-Building",508,267,2018-05-16
774411,Temple of Xiala,game,"15 Feb, 2018",0,Hannes Delbeke,Hannes Delbeke,"Casual, Indie, Early Access",2.15,,,0,2018,"0 .. 20,000",,33,33,"Indie, Casual, Early Access, Puzzle",42,39,2018-02-15
42710,Call of Duty®: Black Ops,game,"8 Nov, 2010",0,Treyarch,Activision,Action,56.0,81.0,20966.0,0,2010,"2,000,000 .. 5,000,000",,2586,568,"Action, FPS, Zombies, Multiplayer, Shooter",15124,2010,2010-11-08
