appid,name,type,release_date,required_age,developers,publishers,genres,price,metacritic_score,recommendations,achievements,year,owners_estimate,players_forever,average_playtime,median_playtime,tags,positive_reviews,negative_reviews,release_date_parsed
1002920,The Last Dinner,game,"10 Jan, 2019",0,西安乐趣软件科技有限公司,西安乐趣软件科技有限公司,Free To Play,0.0,,,0,2019,"0 .. 20,000",,0,0,"Free to Play, Gore, VR, Horror",21,18,2019-01-10
532170,WaveLand,game,"18 Apr, 2017",0,rologfos,rologfos,"Action, Adventure, Indie, Racing",5.25,,,0,2017,"0 .. 20,000",,21608,43168,"Action, Indie, Racing, Adventure, Platformer",63,10,2017-04-18
522240,Pool Panic,game,"19 Jul, 2018",0,Rekim,Rekim,"Action, Adventure, Sports",14.5,,138.0,0,2018,"20,000 .. 50,000",,191,129,"Sports, Action, Adventure, Funny, Puzzle",302,84,2018-07-19
445350,Atomic Space Command,game,"13 Oct, 2016",0,"No, You Shut Up Inc.","No, You Shut Up Inc.","Action, Simulation, Strategy, Early Access",15.0,,,0,2016,"0 .. 20,000",,0,0,"Strategy, Action, Early Access, Simulation, Co-op",7,11,2016-10-13
951010,Zero spring episode 1 English translation version,game,"24 Oct, 2018",0,Sonic-Alpha,NS,"Action, Adventure, Indie",1.1,,,0,2018,"0 .. 20,000",,0,0,"Indie, Gore, Action, Adventure, Violent",5,3,2018-10-24
410770,Roads of Rome,game,"16 Oct, 2015",0,Qumaron,Qumaron,"Adventure, Casual, Simulation, Strategy",4.5,,,0,2015,"0 .. 20,000",,0,0,"Casual, Strategy, Adventure, Simulation, Time Management",81,12,2015-10-16
330100,BossConstructor,game,"24 Oct, 2016",0,Neomateria Games GmbH,Neomateria Games GmbH,"Action, Indie, RPG, Simulation",15.0,,189.0,0,2016,"20,000 .. 50,000",,337,606,"Indie, Action, RPG, Simulation, Space",158,56,2016-10-24
674940,Stick Fight: The Game,game,"28 Sep, 2017",0,Landfall West,Landfall,"Action, Casual, Indie",2.69,,98768.0,0,2017,"2,000,000 .. 5,000,000",,400,187,"Multiplayer, Funny, Fighting, Local Multiplayer, Action",114720,7938,2017-09-28
446550,Infinite Minigolf,game,"25 Jul, 2017",0,Zen Studios,Zen Studios,"Casual, Indie, Sports",15.0,,107.0,0,2017,"20,000 .. 50,000",,0,0,"Mini Golf, Golf, Level Editor, VR, Indie",99,29,2017-07-25
434150,Dark Night,game,"11 Jan, 2016",0,NighthoodGames,NighthoodGames,"Adventure, Indie",2.15,,,0,2016,"0 .. 20,000",,0,0,"Indie, Adventure, Horror",23,39,2016-01-11
557400,Midas Gold Plus - Idle Clicker,game,"1 Feb, 2017",0,Holyday Studios,Holyday Studios,"Casual, Indie, RPG, Free To Play",0.0,,293.0,0,2017,"200,000 .. 500,000",,901,298,"Free to Play, Clicker, Indie, Casual, Singleplayer",1505,250,2017-02-01
590640,Professor Teaches® Excel 2016 – Mac,game,"28 Feb, 2017",0,Individual Software,Individual Software,Software Training,14.5,,,0,2017,"0 .. 20,000",,0,0,,0,0,2017-02-28
288100,MechRunner,game,"15 Jul, 2016",0,Spark Plug Games,Spark Plug Games,Action,7.5,,,0,2016,"0 .. 20,000",,0,0,"Action, Sci-fi, Mechs, Robots, Arcade",12,15,2016-07-15
1050190,Fast Travel: Loot Delivery Service,game,"20 Apr, 2019",0,Souper Chef,Souper Chef,Racing,0.0,,,0,2019,"0 .. 20,000",,0,0,"Racing, Time Attack",9,0,2019-04-20
463850,Muddy Heights® 2,game,"19 Apr, 2016",0,"Rageborn Studio, LLC","Rageborn Studio, LLC",Casual,3.25,,390.0,0,2016,"20,000 .. 50,000",,64,89,"Casual, Funny, Psychological Horror, Singleplayer, Sexual Content",338,65,2016-04-19
906600,Gunkid 99,game,"13 Mar, 2019",0,Yongjustyong,Yongjustyong,"Action, Indie",6.5,,,0,2019,"0 .. 20,000",,0,0,"Indie, Action, Platformer, Arcade, 2D",60,3,2019-03-13
496990,Ghost Sweeper,game,"22 Jul, 2016",0,7 Raven Studios,7 Raven Studios,"Action, Adventure, Casual, Indie",4.25,,,0,2016,"0 .. 20,000",,250,255,"Action, Adventure, Indie, Casual, Puzzle-Platformer",34,4,2016-07-22
1147490,Frontline: Western Front,game,"13 Sep, 2019",0,Frontline: Games Series,Frontline: Games Series,"Indie, Simulation, Strategy",6.5,,,0,2019,"20,000 .. 50,000",,0,0,"Strategy, Simulation, Indie, World War II, Wargame",40,11,2019-09-13
263400,War of the Human Tanks,game,"10 Jan, 2014",0,Yakiniku Banzai,Fruitbat Factory,"Adventure, Indie, Strategy",10.0,,335.0,0,2014,"100,000 .. 200,000",,254,316,"Strategy, Turn-Based Tactics, Anime, War, Robots",469,73,2014-01-10
564050,Bud Spencer & Terence Hill - Slaps And Beans,game,"20 Apr, 2018",0,Trinity Team,Buddy Productions GmbH,"Action, Adventure, Indie",4.35,,1680.0,0,2018,"50,000 .. 100,000",,615,600,"Beat 'em up, Action, Pixel Graphics, Retro, Arcade",1755,154,2018-04-20
924090,Trip in HELL,game,"5 Sep, 2018",0,"Nikita ""Ghost_RUS""",Ghost_RUS Games,"Violent, Gore, Action, Adventure, Indie, Massively Multiplayer",5.25,,,0,2018,"0 .. 20,000",,0,0,"Action, Adventure, Indie, Gore, Violent",9,8,2018-09-05
903760,BinaryBotsVR,game,"22 Nov, 2018",0,cbinfosystems,cbinfosystems,"Adventure, Free To Play",0.0,,,0,2018,"0 .. 20,000",,0,0,"Adventure, Free to Play, VR",9,6,2018-11-22
648020,The Fleet,game,"16 Jun, 2017",0,Choice of Games,Choice of Games,"Adventure, Indie, RPG",5.25,,,0,2017,"0 .. 20,000",,0,0,"Adventure, Indie, RPG, Choose Your Own Adventure, Text-Based",8,6,2017-06-16
758090,Monobeno,game,"26 Jan, 2018",0,Lose,HIKARI FIELD,Adventure,22.0,,493.0,0,2018,"0 .. 20,000",,1772,2545,"Adventure, Anime, Visual Novel, Sexual Content, Nudity",611,32,2018-01-26
857500,BLACK BIRD,game,"30 Oct, 2018",0,Onion Games,Onion Games,"Action, Indie",18.0,,,0,2018,"0 .. 20,000",,140,140,"Shoot 'Em Up, Dark Fantasy, Replay Value, Soundtrack, Side Scroller",91,8,2018-10-30
748980,Tico,game,"21 Nov, 2017",0,baKno Games,baKno Games,"Casual, Indie",22.0,,,0,2017,"0 .. 20,000",,0,0,"Indie, Casual",6,1,2017-11-21
1032730,Sticks And Bones,game,"28 Mar, 2019",0,Bold Statement Games,Bold Statement Games,"Action, Adventure, Casual, Indie",6.5,,113.0,0,2019,"20,000 .. 50,000",,0,0,"Adventure, Indie, Action, Casual, Pirates",119,13,2019-03-28
1031660,Mango Cart,game,"25 Mar, 2019",0,AkriGames,AkriGames,"Indie, Simulation, Strategy",4.25,,,0,2019,"0 .. 20,000",,0,0,"Simulation, Strategy, Indie, Trading, Economy",5,3,2019-03-25
651990,The Montana Chronicles: Montana's Croatoa,game,"7 Jul, 2017",0,Austin Boucher,Austin Boucher,"Violent, Casual, Indie, Strategy",2.15,,,0,2017,"0 .. 20,000",,0,0,"Casual, Violent, Strategy, Indie",1,0,2017-07-07
710880,Dark Rising,game,"20 Oct, 2017",0,Clear Light Games,Clear Light Games,"Indie, Strategy",8.5,,,0,2017,"0 .. 20,000",,0,0,"Strategy, Indie, Tower Defense",5,11,2017-10-20
865630,One Hundred Times Me,game,"19 Feb, 2019",0,Retryable,Retryable,"Action, Indie",3.25,,,0,2019,"0 .. 20,000",,0,0,"Action, Indie, Gore, Singleplayer, 2D",8,1,2019-02-19
896240,The Grand Museum VR,game,"20 Jul, 2018",0,Owlgorithm,Owlgorithm LLC,"Adventure, Casual, Indie, Simulation",10.0,,,0,2018,"0 .. 20,000",,0,0,"Adventure, Indie, Casual, Simulation, VR",1,3,2018-07-20
48800,Ship Simulator Extremes,game,"27 Aug, 2010",0,VStep,Paradox Interactive,Simulation,23.0,49.0,1701.0,0,2010,"200,000 .. 500,000",,517,626,"Simulation, Realistic, Naval, Open World, Multiplayer",1150,1112,2010-08-27
426040,Goodnight Butcher,game,"18 Dec, 2015",0,Perfect Square Studios,Perfect Square Studios,Indie,2.5,,,0,2015,"0 .. 20,000",,231,230,"Indie, Horror",30,26,2015-12-18
939740,Qian-Shan Village / 殭屍山莊,game,"1 Aug, 2019",0,The Barking Dog Entertainment,The Barking Dog Entertainment,"Action, Adventure, Indie, RPG, Early Access",18.0,,,0,2019,"0 .. 20,000",,0,0,"Action, RPG, Indie, Early Access, Gore",2,3,2019-08-01
1093670,ATTACK OF THE EVIL POOP,game,"9 Jul, 2019",0,"Ascend Digitally, Alejandro Navarro",Ascend Digitally,"Action, Casual",5.25,,,0,2019,"0 .. 20,000",,0,0,"Action, Casual, Shooter, Memes, Arcade",39,8,2019-07-09
746710,Cypher,game,"20 Feb, 2018",0,Matthew Brown,Matthew Brown,Indie,5.25,,850.0,0,2018,"20,000 .. 50,000",,331,155,"Puzzle, Indie, Difficult, Minimalist, Education",777,77,2018-02-20
252030,Valdis Story: Abyssal City,game,"30 Oct, 2013",0,Endlessfluff Games,Endlessfluff Games,"Action, Indie, RPG",14.5,83.0,2268.0,0,2013,"200,000 .. 500,000",,385,84,"Metroidvania, Action, Platformer, RPG, Indie",2254,434,2013-10-30
677230,Around the Words,game,"8 Aug, 2017",0,3DDUO,Plug In Digital,"Casual, Indie",4.5,,,0,2017,"0 .. 20,000",,0,0,"Indie, Casual",4,6,2017-08-08
241760,Kill to Collect,game,"6 Apr, 2016",0,Pieces Interactive,"HandyGames, Pieces Interactive","Action, Adventure, Indie",9.9,57.0,168.0,0,2016,"50,000 .. 100,000",,144,177,"Action Roguelike, Twin Stick Shooter, Rogue-lite, PvP, Difficult",202,89,2016-04-06
805850,Wrecked,game,"21 May, 2018",0,Marco Amadei,Corvostudio di Amadei Marco,"Action, Free To Play, Massively Multiplayer, Racing, Sports, Strategy",0.0,,,0,2018,"500,000 .. 1,000,000",,79,52,"Free to Play, Racing, Action, Massively Multiplayer, Strategy",1768,513,2018-05-21
213390,Atooms to Moolecules Demo,game,"6 Apr, 2012",0,BitSits Games,BitSits Games,"Indie, Casual",0.0,,,0,2012,"0 .. 20,000",,0,0,"Casual, Indie",10,6,2012-04-06
856560,Black Roses,game,"28 May, 2018",0,Naughty Squirrels,Naughty Squirrels,"Action, Adventure, Casual, Indie, RPG",1.1,,,0,2018,"20,000 .. 50,000",,0,0,"Action, Adventure, RPG, Indie, Casual",1,1,2018-05-28
896400,Alien Attack: Pocket Edition,game,"1 Aug, 2018",0,Alien Jellyfish,Alien Jellyfish,"Action, Casual, Indie, Simulation",2.5,,,0,2018,"0 .. 20,000",,0,0,"Action, Indie, Casual, Simulation, Pixel Graphics",18,1,2018-08-01
692610,Two Escapes,game,"30 Aug, 2017",0,Whitefish Software,Whitefish Software,"Action, Casual, Indie",2.5,,,0,2017,"0 .. 20,000",,0,0,"Action, Indie, Casual, Puzzle-Platformer",2,0,2017-08-30
517370,Tavernier,game,"25 Aug, 2016",0,From The Bard,From The Bard,"Indie, RPG, Simulation, Strategy",3.5,,148.0,0,2016,"20,000 .. 50,000",,1728,1745,"RPG, Indie, Strategy, Simulation, Visual Novel",133,41,2016-08-25
1057540,Cthulhu Saves Christmas,game,"23 Dec, 2019",0,Zeboyd Digital Entertainment LLC,Zeboyd Digital Entertainment LLC,"Indie, RPG",10.0,,274.0,0,2019,"20,000 .. 50,000",,213,318,"JRPG, Comedy, Lovecraftian, Turn-Based Combat, RPG",278,27,2019-12-23
672720,Crime Solitaire 2: The Smoking Gun,game,"26 Jul, 2017",0,Desktop Gaming,Desktop Gaming,Casual,3.25,,,0,2017,"0 .. 20,000",,0,0,Casual,4,2,2017-07-26
235520,The White Laboratory,game,"28 Mar, 2019",0,Laboratory Systems,"Laboratory Systems, Gamirror Games","Indie, Strategy",10.0,,273.0,0,2019,"50,000 .. 100,000",,100,102,"Indie, Strategy, Tower Defense, Sandbox, Physics",278,78,2019-03-28
432540,Devil Sealing Stone,game,"11 Apr, 2016",0,WJLEGAME,WJLEGAME,"Action, Adventure, Indie, RPG",8.5,,,0,2016,"0 .. 20,000",,0,0,"Action, Adventure, Indie, RPG, RPGMaker",4,3,2016-04-11
409660,Angry Video Game Nerd II: ASSimilation,game,"29 Mar, 2016",0,FreakZone Games,Retroware,"Action, Adventure, Indie",4.2,,666.0,0,2016,"20,000 .. 50,000",,200,165,"Action, Indie, Adventure, Platformer, Gore",696,87,2016-03-29
1016010,W4RR-i/o-RS: Descent,game,"20 Feb, 2019",0,Xeneder,Phoenix Reborn Games,"Indie, Simulation",5.25,,,0,2019,"0 .. 20,000",,0,0,"Indie, Simulation",7,4,2019-02-20
662830,Bombix,game,"2 Mar, 2018",0,Pragmatix Ltd,Pragmatix Ltd,"Action, RPG, Strategy",0.0,,,0,2018,"200,000 .. 500,000",,274,108,"Strategy, Action, RPG, Free to Play, Multiplayer",1025,443,2018-03-02
1124860,Otter Space Rescue,game,"27 Aug, 2019",0,Noah Lewin,Day Dreamer Games,"Action, Adventure, Indie",1.1,,,0,2019,"20,000 .. 50,000",,0,0,"Top-Down Shooter, Bullet Hell, Family Friendly, Action, Rogue-lite",4,1,2019-08-27
115800,Owlboy,game,"1 Nov, 2016",0,D-Pad Studio,D-Pad Studio,"Action, Adventure, Indie",18.5,88.0,3567.0,0,2016,"500,000 .. 1,000,000",,343,232,"Pixel Graphics, Adventure, Indie, Platformer, Metroidvania",4918,956,2016-11-01
386840,Sentinel 4: Dark Star,game,"13 Aug, 2015",0,Origin8 Technologies Ltd,Origin8 Technologies Ltd,"Indie, Strategy",7.5,,,0,2015,"0 .. 20,000",,215,218,"Strategy, Indie, Sci-fi, Tower Defense",47,13,2015-08-13
2320,Quake II,game,"3 Aug, 2007",0,"id Software, Nightdive Studios, MachineGames",Bethesda Softworks,Action,14.45,,7947.0,0,2007,"1,000,000 .. 2,000,000",,357,104,"FPS, Classic, Action, Shooter, Boomer Shooter",8821,407,2007-08-03
1005300,The Jackbox Party Pack 6,game,"16 Oct, 2019",0,"Jackbox Games, Inc.","Jackbox Games, Inc.","Casual, Indie, Strategy",26.0,80.0,2269.0,0,2019,"200,000 .. 500,000",,589,305,"Trivia, Casual, Multiplayer, Local Multiplayer, Indie",2812,145,2019-10-16
415200,Motorsport Manager,game,"9 Nov, 2016",0,Playsport Games,Miniclip,"Racing, Simulation, Sports, Strategy",30.0,81.0,11157.0,0,2016,"500,000 .. 1,000,000",,3516,1126,"Management, Racing, Simulation, Strategy, Sports",12504,1132,2016-11-09
243970,"Invisible, Inc.",game,"12 May, 2015",0,Klei Entertainment,Klei Entertainment,"Action, Indie, Strategy",18.5,82.0,4998.0,0,2015,"1,000,000 .. 2,000,000",,543,185,"Cyberpunk, Difficult, Turn-Based Tactics, Isometric, Strategy",5126,481,2015-05-12
671180,Elementals Reborn,game,"21 Aug, 2017",0,"alexnown, Kunio",alexnown,"Action, Strategy",2.15,,,0,2017,"0 .. 20,000",,0,0,"Strategy, Action, 2D, Indie, Tower Defense",4,5,2017-08-21
714510,Chaos Souls,game,"7 Nov, 2017",0,Visualnoveler,Visualnoveler,"Action, Adventure, Indie",0.0,,,0,2017,"0 .. 20,000",,0,0,"Adventure, Action, Indie, Anime, Female Protagonist",12,12,2017-11-07
39530,Painkiller: Black Edition,game,"24 Jan, 2007",0,People Can Fly,Prime Matter,Action,12.99,,1776.0,0,2007,"100,000 .. 200,000",,392,237,"Gore, Action, FPS, Classic, Shooter",1823,217,2007-01-24
386510,Pyramid Raid,game,"15 Dec, 2015",0,Travian Games GmbH,Travian Games GmbH,"Action, Casual, Indie",3.5,,,0,2015,"20,000 .. 50,000",,11,14,"Action, Indie, Casual, Free to Play, Platformer",96,64,2015-12-15
320410,Near Impact,game,"16 Sep, 2014",0,Sonalysts Combat Simulations,Strategy First,"Action, Strategy",10.5,,,0,2014,"0 .. 20,000",,0,0,"Strategy, Action",2,6,2014-09-16
1114660,4K Bricks Breaker Plus,game,"2 Oct, 2019",0,PhantomHeadache,PhantomHeadache,Indie,2.15,,,0,2019,"0 .. 20,000",,0,0,"Singleplayer, Indie, Arcade, 2D, 2D Platformer",3,2,2019-10-02
1059430,PAGAN PEAK VR,game,"30 Oct, 2019",0,anotherworld GmbH,anotherworld GmbH,Adventure,8.5,,163.0,0,2019,"0 .. 20,000",,89,89,"Adventure, VR, Horror, Escape Room, Thriller",157,30,2019-10-30
990180,The Ghost of You,game,"21 Dec, 2018",0,Noodletub Games,Noodletub Games,"Adventure, Indie",6.5,,,0,2018,"0 .. 20,000",,0,0,"Gore, Violent, Adventure, Indie, Text-Based",29,1,2018-12-21
1164010,Mouse Cursor,game,"7 Oct, 2019",0,chengcong,chengcong,Utilities,2.15,,186.0,0,2019,"0 .. 20,000",,1037,1193,Utilities,148,43,2019-10-07
1046070,Helltower,game,"26 Mar, 2019",0,Dragonware,Dragonware,"Action, Adventure, Indie",5.25,,,0,2019,"0 .. 20,000",,0,0,"Action, Indie, Adventure",3,1,2019-03-26
758190,Dragon Cliff,game,"11 May, 2018",0,Meta Interaction,Meta Interaction,"Adventure, Casual, Indie, RPG, Simulation, Strategy",2.0,,7463.0,0,2018,"500,000 .. 1,000,000",,3696,1240,"RPG, Strategy, Idler, Loot, Pixel Graphics",6998,826,2018-05-11
471400,Space Jammers,game,"8 Mar, 2017",0,Spread Shot Studios LLC,Spread Shot Studios LLC,"Action, Adventure, Indie, Early Access",14.5,,,0,2017,"0 .. 20,000",,0,0,"Early Access, Action, Indie, Adventure, Top-Down Shooter",8,6,2017-03-08
797020,TinyWar high-speed,game,"21 Feb, 2018",0,Masakazu Yanai,Rutenn no oheya,"Indie, Simulation, Strategy",10.0,,,0,2018,"0 .. 20,000",,0,0,"Strategy, Indie, Simulation",11,0,2018-02-21
969420,Dereliction,game,"22 Nov, 2018",0,Alex Zimich,Alex Zimich,Strategy,1.1,,,0,2018,"0 .. 20,000",,0,0,"Strategy, Violent, Indie",1,0,2018-11-22
302570,Dangerous,game,"16 Dec, 2014",0,Binary Helix,XP,"Action, Adventure, Indie, RPG, Simulation, Strategy",20.0,,,0,2014,"20,000 .. 50,000",,0,0,"Indie, Simulation, RPG, Strategy, Action",14,35,2014-12-16
1135450,Psy High 2: High Summer,game,"15 Aug, 2019",0,Choice of Games,Choice of Games,"Adventure, Indie, RPG",7.5,,,0,2019,"0 .. 20,000",,0,0,"Adventure, RPG, Indie, Text-Based",10,1,2019-08-15
409870,Phantom Brave PC,game,"25 Jul, 2016",0,"Nippon Ichi Software, Inc., PH3 GmbH","NIS America, Inc.",RPG,29.0,,564.0,0,2016,"100,000 .. 200,000",,239,343,"RPG, JRPG, Strategy RPG, Anime, Pixel Graphics",551,95,2016-07-25
840430,Planetary Dustoff,game,"16 Dec, 2019",0,Rymdfall AB,Rymdfall AB,"Action, Indie",10.0,,,0,2019,"0 .. 20,000",,0,0,"Action Roguelike, Indie, Action, Rogue-lite, Top-Down Shooter",42,5,2019-12-16
980560,Overcraft,game,"24 Jan, 2019",0,SunshineOvercast,SunshineOvercast,"Casual, Indie",2.15,,,0,2019,"0 .. 20,000",,0,0,,0,0,2019-01-24
794180,PRO FISHING SIMULATOR,game,"29 Nov, 2018",0,Sanuk Games,Nacon,"Casual, Simulation, Sports",10.0,,,0,2018,"20,000 .. 50,000",,0,0,"Simulation, Casual, Sports, Fishing",32,26,2018-11-29
664060,Willful,game,"9 Aug, 2017",0,Luke Vincent,Luke Vincent,Adventure,4.5,,,0,2017,"0 .. 20,000",,0,0,"Adventure, Platformer, Action, Indie",9,2,2017-08-09
377710,Idol Magical Girl Chiru Chiru Michiru Part 1,game,"29 Jul, 2015",0,Frontwing,Frontwing USA,"Adventure, Casual",20.0,,,0,2015,"0 .. 20,000",,349,406,"Visual Novel, Anime, Female Protagonist, Magic, Adventure",166,23,2015-07-29
625560,The Overdreamer,game,"16 Jul, 2017",0,Hars,Hars,"Adventure, Indie",5.25,,,0,2017,"0 .. 20,000",,210,210,"Adventure, Indie, Horror, Side Scroller, 2D",14,2,2017-07-16
581370,Drizzlepath: Glass,game,"14 Feb, 2017",0,Tonguç Bodur,Tonguç Bodur,"Adventure, Casual, Indie, Simulation",4.25,,163.0,0,2017,"0 .. 20,000",,262,262,"Adventure, Indie, Casual, Walking Simulator, Atmospheric",113,69,2017-02-14
1035270,Furry Chronicles,game,"10 Mar, 2019",0,DYSTANT Games,DYSTANT Games,"Action, Adventure, Casual, Indie",3.25,,,0,2019,"0 .. 20,000",,0,0,"Action, Casual, Indie, Adventure, Platformer",3,4,2019-03-10
1182370,Mr. Hopp's Playhouse,game,"15 Nov, 2019",0,Moonbit,Moonbit,"Free To Play, Indie, Strategy",0.0,,,0,2019,"100,000 .. 200,000",,0,0,"Horror, Free to Play, Indie, Singleplayer, Survival Horror",1562,108,2019-11-15
410040,Hope in Hell,game,"4 Nov, 2015",0,Emeryon games,Emeryon games,"Action, Adventure, Casual, Indie",3.5,,,0,2015,"0 .. 20,000",,0,0,"Indie, Action, Casual, Adventure, Beat 'em up",1,9,2015-11-04
729130,Sound Soarer,game,"11 Oct, 2017",0,Bjarki Arge Andreasen,Bjarki Arge Andreasen,"Casual, Indie",5.25,,,0,2017,"0 .. 20,000",,0,0,"Indie, Casual",1,1,2017-10-11
341090,On A Roll 3D,game,"12 Feb, 2015",0,Battenberg Software,Battenberg Software,"Action, Adventure, Casual, Indie",4.25,,,0,2015,"50,000 .. 100,000",,222,171,"Adventure, Action, Indie, Casual, Platformer",229,36,2015-02-12
338070,ルナティックドーン レジェンドパック,game,"8 Jan, 2015",0,ARTDINK,KOMODO,RPG,29.0,,,0,2015,"20,000 .. 50,000",,0,0,"RPG, Open World, Classic, Pixel Graphics, Turn-Based Combat",20,3,2015-01-08
849200,Shadow of the Tomb Raider: Definitive Edition,game,"14 Sep, 2018",18,"Eidos-Montréal, Crystal Dynamics, Nixxes, Feral Interactive (Mac), Feral interactive (Linux)","Crystal Dynamics, Feral Interactive (Mac), Feral interactive (Linux)","Action, Adventure",0.0,77.0,66346.0,0,2018,"0 .. 20,000",,0,0,"Adventure, Lara Croft, Action, Female Protagonist, Third Person",12657,4677,2018-09-14
746680,Bounce Rescue!,game,"1 Feb, 2018",0,Bitecore Ltd.,Bitecore Ltd.,"Adventure, Indie",2.15,,,0,2018,"0 .. 20,000",,5,5,"Adventure, Indie, Platformer, Difficult, Cute",6,5,2018-02-01
524220,NieR:Automata™,game,"Mar 17, 2017",0,"Square Enix, PlatinumGames Inc.",Square Enix,"Action, RPG",39.99,84.0,108887.0,0,2017,"2,000,000 .. 5,000,000",,1457,710,"Great Soundtrack, Story Rich, Female Protagonist, Hack and Slash, Action",122027,18142,
285840,Enemy Mind,game,"6 Jun, 2014",0,Schell Games,Schell Games,"Action, Indie",9.99,,106.0,0,2014,"50,000 .. 100,000",,182,171,"Action, Shoot 'Em Up, Shooter, Space, Pixel Graphics",672,118,2014-06-06
24780,SimCity™ 4 Deluxe Edition,game,"20 Jul, 2010",0,"EA - Maxis, Aspyr (Mac)","Electronic Arts, Aspyr (Mac)","Simulation, Strategy",4.99,,8074.0,0,2010,"500,000 .. 1,000,000",,1433,151,"City Builder, Immersive Sim, Base-Building, Building, Sandbox",7456,1652,2010-07-20
423900,Dinocide,game,"21 Jan, 2016",0,AtomicTorch Studio,AtomicTorch Studio,"Action, Adventure, Casual, Indie, RPG",8.5,51.0,,0,2016,"20,000 .. 50,000",,79,102,"Action, Indie, Platformer, Adventure, Pixel Graphics",122,105,2016-01-21
514930,Super Hop 'N' Bop ULTRA,game,"17 Oct, 2016",0,CTgames,Flying Interactive,"Action, Casual, Indie",2.15,,,0,2016,"0 .. 20,000",,0,0,"Action, Indie, Casual, Retro, 2D",7,5,2016-10-17
758440,Last Rose,game,"30 Aug, 2019",0,phil,phil,"Adventure, Indie, RPG",0.0,,,0,2019,"0 .. 20,000",,0,0,"RPG, Adventure, Indie, Nudity",12,2,2019-08-30
1110200,Spaceman Defender,game,"19 Jul, 2019",0,LoadUpGames.com,LoadUpGames.com,"Action, Indie",2.15,,,0,2019,"20,000 .. 50,000",,0,0,"Action, Shooter, Retro, Arcade, Bullet Hell",1,1,2019-07-19
936600,Shoot'n'Scroll 3D,game,"3 Oct, 2018",0,PlayMobileFree,Dikobraz Games,"Action, Indie",5.25,,,0,2018,"0 .. 20,000",,0,0,"Action, Indie",3,0,2018-10-03
973100,Super Realistic Autocross,game,"6 Aug, 2019",0,"Doonamai, LLC","Doonamai, LLC","Casual, Indie, Racing, Simulation, Sports",0.0,,,0,2019,"0 .. 20,000",,0,0,"Racing, Indie, Casual, Simulation, Sports",12,1,2019-08-06
697550,It Lurks Below,game,"29 May, 2019",0,Graybeard Games,Skystone Games,"Action, Indie, RPG",18.5,,1139.0,0,2019,"50,000 .. 100,000",,1243,2154,"RPG, Indie, Action, Survival, Pixel Graphics",1041,198,2019-05-29
771070,Infinos Gaiden,game,"19 Jan, 2018",0,Picorinne Soft,Picorinne Soft,"Action, Indie",11.0,,,0,2018,"0 .. 20,000",,0,0,"Action, Indie, Shoot 'Em Up, Pixel Graphics, 2D",76,1,2018-01-19
556830,GemWars,game,"29 Nov, 2016",0,"uyi technology Co,Ltd","uyi technology Co,Ltd","Action, Adventure, Casual, Simulation",8.5,,,0,2016,"0 .. 20,000",,0,0,"Action, Adventure, Casual, Simulation, VR",3,0,2016-11-29
1139200,World left Behind,game,"13 Sep, 2019",0,keron veal,keron veal,"Action, Adventure, Casual, Indie, RPG",0.0,,,0,2019,"0 .. 20,000",,0,0,"Action, Indie, RPG, Casual, Adventure",15,2,2019-09-13
562010,Tanki Online,game,"2 Mar, 2017",0,Alternativa Game Ltd.,APL Publishing Ltd.,"Action, Massively Multiplayer, Free To Play",0.0,,,0,2017,"100,000 .. 200,000",,243,78,"Free to Play, Tanks, Futuristic, Massively Multiplayer, Hand-drawn",4041,2515,2017-03-02
1171250,Suka's Escape,game,"29 Oct, 2019",0,Flying Escape Kick Studios,Flying Escape Kick Studios,"Action, Adventure, Simulation, Early Access",10.0,,,0,2019,"0 .. 20,000",,0,0,,0,0,2019-10-29
890220,Math Fun,game,"4 Aug, 2018",0,Yash Future Tech Solutions Pvt Ltd,Yash Future Tech Solutions Pvt Ltd,"Casual, Indie, Strategy",5.25,,,0,2018,"0 .. 20,000",,0,0,"Education, Story Rich, Difficult, NSFW, Cult Classic",124,31,2018-08-04
251430,The Inner World,game,"27 Sep, 2013",0,Studio Fizbin,Headup,"Adventure, Indie",1.45,72.0,865.0,0,2013,"100,000 .. 200,000",,275,220,"Adventure, Point & Click, Puzzle, Indie, Story Rich",1246,148,2013-09-27
399130,Massive Cleavage vs Zombies: Awesome Edition,game,"8 Jul, 2016",0,Awesome Enterprises,Awesome Enterprises,"Action, Casual, Indie",1.1,,142.0,0,2016,"100,000 .. 200,000",,312,355,"Gore, Action, Indie, Casual, Violent",94,101,2016-07-08
545980,Voodoo Vince: Remastered,game,"17 Apr, 2017",0,"Beep Games, Inc.","Beep Games, Inc.","Action, Adventure",14.5,63.0,518.0,0,2017,"50,000 .. 100,000",,394,570,"Action, Adventure, 3D Platformer, Great Soundtrack, Cult Classic",504,40,2017-04-17
830490,Achievement Lurker: You are going to have to work hard for these nuts,game,"19 Jun, 2018",0,Perverse Games,Perverse Games,RPG,2.15,,,0,2018,"0 .. 20,000",,0,0,"RPG, RPGMaker",68,19,2018-06-19
247370,Mutant Mudds Deluxe,game,"21 Nov, 2013",0,Atooi,Atooi,"Action, Adventure, Indie",10.0,,397.0,0,2013,"50,000 .. 100,000",,155,112,"Platformer, Indie, Action, Retro, Pixel Graphics",455,155,2013-11-21
562160,The Inner Darkness,game,"24 Feb, 2017",0,Nauris Amatnieks,Nauris Amatnieks,"Adventure, Casual, Indie",5.5,,,0,2017,"20,000 .. 50,000",,473,764,"Time Manipulation, Puzzle, Puzzle-Platformer, Dark, Short",74,27,2017-02-24
1133770,Witch Halloween,game,"31 Oct, 2019",0,Towndarktales,Towndarktales,"Adventure, Casual, Indie, Simulation",7.5,,256.0,0,2019,"0 .. 20,000",,112,112,,0,0,2019-10-31
256576,CSX ES44AC Add-on Livery,game,"1 Jan, 2009",0,Dovetail Games,Dovetail Games,Simulation,5.5,,,0,2009,"0 .. 20,000",,0,0,,0,0,2009-01-01
687850,Head Goal: Soccer Online,game,"18 Aug, 2017",0,Unusualsoft,Unusualsoft,Sports,1.1,,146.0,0,2017,"50,000 .. 100,000",,174,106,"Sports, Football (Soccer), PvP, e-sports, Multiplayer",630,166,2017-08-18
656940,The Theodore Adventures,game,"20 Jul, 2017",0,norum82, Conglomerate 5,"Adventure, Casual, Indie",1.1,,,0,2017,"0 .. 20,000",,1,1,"Adventure, Indie, Casual, Platformer, Action",21,22,2017-07-20
445230,Lost girl`s [diary],game,"24 Mar, 2016",0,SmoleVN,SmoleVN,Free To Play,0.0,,,0,2016,"50,000 .. 100,000",,49,68,"Free to Play, Visual Novel, Anime, Horror, Nudity",902,197,2016-03-24
1148650,The Legend of Bum-Bo,game,"12 Nov, 2019",0,"Edmund McMillen, James Interactive, Ridiculon",Edmund McMillen,"Adventure, Indie, Strategy",14.5,73.0,5579.0,0,2019,"1,000,000 .. 2,000,000",,1253,288,"Rogue-lite, Indie, Strategy, Adventure, Puzzle",4695,1106,2019-11-12
1174810,Curse of the dungeon,game,"31 Oct, 2019",0,Axe Games,Enoops,"Action, Adventure, Casual, Indie, RPG",0.88,,,0,2019,"20,000 .. 50,000",,0,0,"Action, Adventure, RPG, Indie, Casual",2,12,2019-10-31
1174320,Travel Mosaics 10: Spooky Halloween,game,"28 Oct, 2019",0,Jetdogs Studios,Jetdogs Studios,"Adventure, Strategy",1.62,,,0,2019,"0 .. 20,000",,0,0,"Strategy, Adventure, Puzzle, Indie, Casual",16,0,2019-10-28
496930,Sumeru,game,"21 Sep, 2016",0,BigCheeseGames,BigCheeseGames,"Adventure, Casual, Indie",4.25,,135.0,0,2016,"0 .. 20,000",,327,327,"Indie, Casual, Adventure, Physics, Puzzle",122,39,2016-09-21
